{
  "schema_version": "1.1.0",
  "manifest_id": "pr01-raw-search-exports-v2",
  "protocol_id": "PR01",
  "status": "ARCHIVED",
  "created_at_utc": "2026-08-01T16:52:25Z",
  "completed_at_utc": null,
  "search_manifest": {
    "path": "research/metadata/pr01_search_manifest.json",
    "sha256": "03ACA13B9437EA00F430E573FF088355BFC25301A180984319690607A9F544B9"
  },
  "executions": [
    {
      "execution_id": "search-crossref-context-human-nmpc-initial",
      "round_id": "initial",
      "database_id": "crossref",
      "query_id": "qry-crossref-context-human-nmpc",
      "executed_at_utc": "2026-08-01T17:12:57Z",
      "executed_by": "pr01-runner",
      "query_snapshot": {
        "exact_query": "query.bibliographic=nonlinear model predictive control context aware human aware robot mobile mecanum&filter=from-pub-date:2010-01-01,until-pub-date:2026-08-01&sort=score&order=desc&rows=1000",
        "search_fields": [
          "query.bibliographic"
        ],
        "filter_profile_id": "eligibility-2010-2026-en-peer-reviewed",
        "platform_filters": [
          "date:2010-01-01..2026-08-01",
          "language-and-document-type:eligibility-screening"
        ],
        "export_format": "json",
        "retrieval_policy": {
          "mode": "ranked-cap",
          "cap_records_per_query": 1000,
          "page_size": 1000,
          "ordering": "score:desc",
          "pagination_method": "none",
          "reported_total_semantics": "source-reported-unverified",
          "completion_rule": "cap-reached-or-source-exhausted",
          "scope_statement": "Top 1000 relevance-ranked Crossref records per frozen query; this recall-supplement source is explicitly non-exhaustive."
        }
      },
      "retrieved_record_count": 1000,
      "retrieval_outcome": {
        "status": "POLICY-SATISFIED",
        "source_reported_hit_count": 541016,
        "termination_reason": "ranked-cap-reached",
        "incompleteness_reason": null
      },
      "parts": [
        {
          "part_index": 1,
          "record_count": 1000,
          "byte_size": 6826102,
          "format": "json",
          "file": {
            "path": "references/literature/raw/crossref/qry-crossref-context-human-nmpc/part-001.json",
            "sha256": "C69D13CE66584865C8EED064D5F42D46D65BBB4CFFD7DE5CCD62EC93BBB966F2"
          },
          "pagination": null
        }
      ]
    },
    {
      "execution_id": "search-crossref-chance-risk-human-initial",
      "round_id": "initial",
      "database_id": "crossref",
      "query_id": "qry-crossref-chance-risk-human",
      "executed_at_utc": "2026-08-01T17:13:03Z",
      "executed_by": "pr01-runner",
      "query_snapshot": {
        "exact_query": "query.bibliographic=chance constrained risk allocation probabilistic uncertainty model predictive control human pedestrian trajectory&filter=from-pub-date:2010-01-01,until-pub-date:2026-08-01&sort=score&order=desc&rows=1000",
        "search_fields": [
          "query.bibliographic"
        ],
        "filter_profile_id": "eligibility-2010-2026-en-peer-reviewed",
        "platform_filters": [
          "date:2010-01-01..2026-08-01",
          "language-and-document-type:eligibility-screening"
        ],
        "export_format": "json",
        "retrieval_policy": {
          "mode": "ranked-cap",
          "cap_records_per_query": 1000,
          "page_size": 1000,
          "ordering": "score:desc",
          "pagination_method": "none",
          "reported_total_semantics": "source-reported-unverified",
          "completion_rule": "cap-reached-or-source-exhausted",
          "scope_statement": "Top 1000 relevance-ranked Crossref records per frozen query; this recall-supplement source is explicitly non-exhaustive."
        }
      },
      "retrieved_record_count": 1000,
      "retrieval_outcome": {
        "status": "POLICY-SATISFIED",
        "source_reported_hit_count": 412242,
        "termination_reason": "ranked-cap-reached",
        "incompleteness_reason": null
      },
      "parts": [
        {
          "part_index": 1,
          "record_count": 1000,
          "byte_size": 7383550,
          "format": "json",
          "file": {
            "path": "references/literature/raw/crossref/qry-crossref-chance-risk-human/part-001.json",
            "sha256": "F9EBB5E52C2FB1558E69ADA95F5CC5FE1CAEC41B39219B45416E8C9A64786FDC"
          },
          "pagination": null
        }
      ]
    },
    {
      "execution_id": "search-crossref-adaptive-risk-initial",
      "round_id": "initial",
      "database_id": "crossref",
      "query_id": "qry-crossref-adaptive-risk",
      "executed_at_utc": "2026-08-01T17:13:08Z",
      "executed_by": "pr01-runner",
      "query_snapshot": {
        "exact_query": "query.bibliographic=adaptive risk allocation context feasibility learned model predictive control CVaR barrier function&filter=from-pub-date:2010-01-01,until-pub-date:2026-08-01&sort=score&order=desc&rows=1000",
        "search_fields": [
          "query.bibliographic"
        ],
        "filter_profile_id": "eligibility-2010-2026-en-peer-reviewed",
        "platform_filters": [
          "date:2010-01-01..2026-08-01",
          "language-and-document-type:eligibility-screening"
        ],
        "export_format": "json",
        "retrieval_policy": {
          "mode": "ranked-cap",
          "cap_records_per_query": 1000,
          "page_size": 1000,
          "ordering": "score:desc",
          "pagination_method": "none",
          "reported_total_semantics": "source-reported-unverified",
          "completion_rule": "cap-reached-or-source-exhausted",
          "scope_statement": "Top 1000 relevance-ranked Crossref records per frozen query; this recall-supplement source is explicitly non-exhaustive."
        }
      },
      "retrieved_record_count": 1000,
      "retrieval_outcome": {
        "status": "POLICY-SATISFIED",
        "source_reported_hit_count": 403472,
        "termination_reason": "ranked-cap-reached",
        "incompleteness_reason": null
      },
      "parts": [
        {
          "part_index": 1,
          "record_count": 1000,
          "byte_size": 6968876,
          "format": "json",
          "file": {
            "path": "references/literature/raw/crossref/qry-crossref-adaptive-risk/part-001.json",
            "sha256": "AFC637D0521A26E634E98691DB081A2430826D25F934E1CC15E1B65D43273324"
          },
          "pagination": null
        }
      ]
    },
    {
      "execution_id": "search-crossref-elastic-chance-initial",
      "round_id": "initial",
      "database_id": "crossref",
      "query_id": "qry-crossref-elastic-chance",
      "executed_at_utc": "2026-08-01T17:13:13Z",
      "executed_by": "pr01-runner",
      "query_snapshot": {
        "exact_query": "query.bibliographic=elastic chance constraint adaptive probability level online risk value perception aware model predictive control feasibility stability closed loop&filter=from-pub-date:2010-01-01,until-pub-date:2026-08-01&sort=score&order=desc&rows=1000",
        "search_fields": [
          "query.bibliographic"
        ],
        "filter_profile_id": "eligibility-2010-2026-en-peer-reviewed",
        "platform_filters": [
          "date:2010-01-01..2026-08-01",
          "language-and-document-type:eligibility-screening"
        ],
        "export_format": "json",
        "retrieval_policy": {
          "mode": "ranked-cap",
          "cap_records_per_query": 1000,
          "page_size": 1000,
          "ordering": "score:desc",
          "pagination_method": "none",
          "reported_total_semantics": "source-reported-unverified",
          "completion_rule": "cap-reached-or-source-exhausted",
          "scope_statement": "Top 1000 relevance-ranked Crossref records per frozen query; this recall-supplement source is explicitly non-exhaustive."
        }
      },
      "retrieved_record_count": 1000,
      "retrieval_outcome": {
        "status": "POLICY-SATISFIED",
        "source_reported_hit_count": 67069,
        "termination_reason": "ranked-cap-reached",
        "incompleteness_reason": null
      },
      "parts": [
        {
          "part_index": 1,
          "record_count": 1000,
          "byte_size": 6938749,
          "format": "json",
          "file": {
            "path": "references/literature/raw/crossref/qry-crossref-elastic-chance/part-001.json",
            "sha256": "77FDCA57823D9C1322A09EAB64F64DA9E329F836B02998DACC965C4D6E71E9AB"
          },
          "pagination": null
        }
      ]
    },
    {
      "execution_id": "search-crossref-lstm-trajectory-initial",
      "round_id": "initial",
      "database_id": "crossref",
      "query_id": "qry-crossref-lstm-trajectory",
      "executed_at_utc": "2026-08-01T17:13:18Z",
      "executed_by": "pr01-runner",
      "query_snapshot": {
        "exact_query": "query.bibliographic=LSTM recurrent neural network pedestrian human trajectory prediction uncertainty calibration covariance multimodal&filter=from-pub-date:2010-01-01,until-pub-date:2026-08-01&sort=score&order=desc&rows=1000",
        "search_fields": [
          "query.bibliographic"
        ],
        "filter_profile_id": "eligibility-2010-2026-en-peer-reviewed",
        "platform_filters": [
          "date:2010-01-01..2026-08-01",
          "language-and-document-type:eligibility-screening"
        ],
        "export_format": "json",
        "retrieval_policy": {
          "mode": "ranked-cap",
          "cap_records_per_query": 1000,
          "page_size": 1000,
          "ordering": "score:desc",
          "pagination_method": "none",
          "reported_total_semantics": "source-reported-unverified",
          "completion_rule": "cap-reached-or-source-exhausted",
          "scope_statement": "Top 1000 relevance-ranked Crossref records per frozen query; this recall-supplement source is explicitly non-exhaustive."
        }
      },
      "retrieved_record_count": 1000,
      "retrieval_outcome": {